model,reflection_cycles,avg_latency,final_output_excerpt,timestamp,task,execution_time_sec,steps_completed,load_time_sec,final_response_excerpt,final_code_excerpt,review_summary
microsoft/phi-2,2.0,7.79,"Improve this answer based on the reflection:
Reflect on this answer critically and suggest one improvement:
You are an academic research assistant. Generate a concise 5-point summary explaining how autonomous agents extend the capabilities of transformer models in practical reasoning tasks. 
AI: Aut",2025-11-01 08:07:04,,,,,,,
microsoft/phi-2,,,,2025-11-01 08:08:51,"Calculate 24 / 3 + 12, then explain how reasoning agents use tools to enhance LLM decision-making.",11.59,3.0,3.77,"Use the following context to provide a clear final answer:
You are a reasoning agent. Understand and plan how to solve this:
Task: Calculate 24 / 3 + 12, then explain how reasoning agents use tools to enhance LLM decision-making.
Explain your reasoning process step-by-step.

Question: What is the re",,
microsoft/phi-2,,,,2025-11-01 08:09:41,Write a Python function to calculate Fibonacci numbers using recursion. Then print the first 10 numbers and ensure the code is optimized for readability.,28.29,3.0,3.41,,"Now based on your previous reasoning, generate clean, readable Python code that fulfills the task:
Task: Write a Python function to calculate Fibonacci numbers using recursion. Then print the first 10 numbers and ensure the code is optimized for readability.
Include comments for clarity.
## INPUT

#","Review this code for potential logic or syntax issues. Suggest one improvement if possible.

Code:
Now based on your previous reasoning, generate clean, readable Python code that fulfills the task:
Task: Write a Python function to calculate Fibonacci"
